{
  "$schema": "https://json-schema.org/draft/2020-12/schema",
  "$id": "https://provability-fabric.org/schemas/evidence/v0.1/execution-trace.schema.json",
  "title": "EvidenceExecutionTraceV01",
  "type": "object",
  "additionalProperties": false,
  "required": ["schema_version", "trace_id", "events", "trace_digest"],
  "properties": {
    "schema_version": { "const": "0.1" },
    "trace_id": { "type": "string", "minLength": 1 },
    "events": {
      "type": "array",
      "minItems": 1,
      "items": {
        "type": "object",
        "additionalProperties": true,
        "required": ["seq", "kind"],
        "properties": {
          "seq": { "type": "integer", "minimum": 0 },
          "kind": { "type": "string", "minLength": 1 }
        }
      }
    },
    "trace_digest": {
      "type": "string",
      "pattern": "^sha256:[0-9a-f]{64}$"
    }
  }
}
