{
  "schema_version": "0.1",
  "trace_id": "deep-replay-001",
  "events": [
    {
      "id": "event_001",
      "kind": "function_call",
      "payload": {
        "args": [
          1,
          2
        ],
        "function": "add_numbers",
        "hash": "sha256:5d41402abc4b2a76b9719d911017c592"
      },
      "seq": 0
    }
  ],
  "trace_digest": "sha256:348b839df12bd87697912fdcb4a7c35ea3b1da9b8c8569204a7e01c90d4ee209"
}
